Sheet: Sheet1
A1: Ilość | B1: Typ | C1: Wartość | D1: Cena za 1 szt. | E1: Sumarycznie | F1: Uwagi | G1: URL
A2: 2 | B2: C | C2: 100n | D2: 0.45 | E2: of:=[.D2]*[.A2] -> 0.9 | F2: Polipropylenowe | G2: https://www.tme.eu/pl/details/jfz-100n_310-p10/kondensatory-foliowe-tht/jb-capacitors/
A3: 2 | B3: C | C3: 100u | D3: 0 | E3: of:=[.D3]*[.A3] -> 0 | F3: Aluminiowe | G3: Zasoby własne
A4: 3 | B4: C | C4: 100n | D4: 0.81 | E4: of:=[.D4]*[.A4] -> 2.43 | F4: PET | G4: https://www.tme.eu/pl/details/b32529c1104j000/kondensatory-foliowe-tht/epcos/
A5: 1 | B5: C | C5: 22u | D5: 0 | E5: of:=[.D5]*[.A5] -> 0 | F5: Aluminiowe | G5: Zasoby własne
A6: 3 | B6: C | C6: 10n | D6: 2.59 | E6: of:=[.D6]*[.A6] -> 7.77 | F6: Polipropylenowe | G6: https://www.tme.eu/pl/details/r75pf21004030j/kondensatory-foliowe-tht/kemet/
A7: 2 | B7: C | C7: 1u | D7: 1.57 | E7: of:=[.D7]*[.A7] -> 3.14 | F7: Poliester | G7: https://www.tme.eu/pl/details/b32529c105k/kondensatory-foliowe-tht/epcos/b32529c0105k289/
A8: 8 | B8: R | C8: 1k | D8: 0.61 | E8: of:=[.D8]*[.A8] -> 4.88 | F8: 0.1% SMD | G8: https://www.tme.eu/pl/details/ar0805-1k-0.1%25/rezystory-smd/viking/ar05btcw1001/
A9: 8 | B9: R | C9: 2k | D9: 0.67 | E9: of:=[.D9]*[.A9] -> 5.36 | F9: 0.1% SMD | G9: https://www.tme.eu/pl/details/tc0525b2001t5g/rezystory-smd/royal-ohm/
A10: 2 | B10: Rv | C10: 10k | D10: 1.76 | E10: of:=[.D10]*[.A10] -> 3.52 | G10: https://www.tme.eu/pl/details/t910w-10k/potencjometry-tht-wieloobrotowe-3-8-cala/sr-passives/
A11: 1 | B11: Q | C11: 12.288MHz | D11: 7.65 | E11: of:=[.D11]*[.A11] -> 7.65 | F11: Generator Kwarcowy | G11: https://www.tme.eu/pl/details/osc12.288m-3.3_s7/generatory-kwarcowe-smd/yic/
A12: 1 | B12: D | C12: 1n4148 | D12: 0 | E12: of:=[.D12]*[.A12] -> 0 | G12: Zasoby własne
A13: 1 | B13: U | C13: AVR32DA28 | D13: 8.27 | E13: of:=[.D13]*[.A13] -> 8.27 | F13: MCU | G13: https://www.tme.eu/pl/details/avr32da28-i_so/rodzina-avr-8-bit/microchip-technology/
A14: 1 | B14: U | C14: MCP6004 | D14: 4.24 | E14: of:=[.D14]*[.A14] -> 4.24 | F14: OpAmp | G14: https://www.tme.eu/pl/details/mcp6004-i_p/wzmacniacze-operacyjne-tht/microchip-technology/
A15: 1 | B15: U | C15: LM4041C | D15: 5.72 | E15: of:=[.D15]*[.A15] -> 5.72 | F15: Vref | G15: https://www.tme.eu/pl/details/lm4041c12ilpr/zrodla-napiecia-odniesienia-uklady/texas-instruments/
A16: 1 | B16: D | C16: LED | D16: 0 | E16: of:=[.D16]*[.A16] -> 0 | G16: Własne zasoby
A17: 1 | B17: R | C17: Fotorezystor | D17: 0 | E17: of:=[.D17]*[.A17] -> 0 | G17: Własne zasoby
A18: 1 | B18: Q | C18: BC547 | D18: 0 | E18: of:=[.D18]*[.A18] -> 0 | G18: Własne zasoby
E19: of:=[.D19]*[.A19] -> 0
E20: of:=[.D20]*[.A20] -> 0 | J20: Suma:
E21: of:=[.D21]*[.A21] -> 0 | K21: of:=SUM([.E2:.E17]) -> 53.88
E22: of:=[.D22]*[.A22] -> 0
E23: of:=[.D23]*[.A23] -> 0
E24: of:=[.D24]*[.A24] -> 0
E25: of:=[.D25]*[.A25] -> 0
E26: of:=[.D26]*[.A26] -> 0
E27: of:=[.D27]*[.A27] -> 0